I LOve u,2024-02-29
How to use Inscpection v3,2024-02-29
Hi,2024-03-19
How to Eat,2024-03-19
How to dance,2024-03-19
provide abstract for advanced generative ai using streamlit,2024-03-21
provide abstract for advanced generative adversial networks using stream lit,2024-03-21
provide brief introduction for advanced generative adversial networks using stream lit,2024-03-21
provide importance and application for advanced generative adversial networks using stream lit,2024-03-21
provide goal of project  for advanced generative adversial networks using stream lit,2024-03-21
How to eat,2024-03-21
how to get rid of love,2024-03-21
how to get rid of abhilasha,2024-03-21
abstract of gan,2024-03-21
abstract of gan,2024-03-21
provide a implementation work for advanced generative adversisal networks using stream lit,2024-03-22
provide a proposed  work for advanced generative adversisal networks using stream lit,2024-03-22
provide a literature survey for advanced generative adversisal networks using stream lit,2024-03-22
provide a implementation  for advanced generative adversisal networks using stream lit and multi domain chat bot,2024-03-22
provide a experimental analysis for advanced generative adversisal networks using stream lit and multi domain chat bot,2024-03-22
provide a SYSTEM SPECIFICATIONS for advanced generative adversisal networks using stream lit and multi domain chat bot,2024-03-22
provide a SYSTEM SPECIFICATIONS for advanced generative adversisal networks using stream lit and multi domain chat bot,2024-03-22
PROVIDE A CONCLUSION FOR ADVANCED GENERATIVE ADVERSIAL NETWORKS USING STREAMLIT AND MULTI DOMAIN CHAT BOT,2024-03-22
provide  information about objectives for temporal  dimesnion modelling for historical data analysis,2024-03-23
provide ssome real time applications of regression with example problem,2024-03-25
provide some real time applications of regression model,2024-03-25
provide abstract angular bootstrap dashboard master,2024-03-26
provide abstract angular bootstrap dashboard master,2024-03-26
provide brief overview  for angular bootstrap dashboard master,2024-03-26
provide introduction for angular bootstrap dashboard master,2024-03-26
provide introduction for angular bootstrap dashboard master,2024-03-26
